{
  "schema_version": "1.0",
  "id": "sess_1746640800000000000",
  "created_by": "agent-implementer-1",
  "handoff_slug": "hyphae/access-aware-decay",
  "request": "Implement the access-aware decay formula",
  "messages": [
    {
      "sender": "agent-implementer-1",
      "content": "Started implementation of access-aware decay formula",
      "cursor_position": 0,
      "timestamp": "2026-05-07T18:00:00Z"
    },
    {
      "sender": "agent-implementer-1",
      "content": "Completed the core decay calculation function",
      "cursor_position": 1,
      "timestamp": "2026-05-07T18:15:30Z"
    },
    {
      "sender": "agent-validator-1",
      "content": "Joined session to review implementation",
      "cursor_position": 2,
      "timestamp": "2026-05-07T18:30:00Z"
    }
  ],
  "status": "open"
}
